id,hero_id,language,description,race,created_at,updated_at
1,1,en,"Superman is a fictional superhero appearing in American comic books published by DC Comics. The character was created by writer Jerry Siegel and artist Joe Shuster, and first appeared in Action Comics #1 (cover-dated June 1938 and published April 18, 1938).",Kryptonian,2022-04-27 10:00:00,2022-04-27 10:00:00
2,1,nl,"Superman is een fictieve superheld die voorkomt in Amerikaanse stripboeken uitgegeven door DC Comics. Het personage werd bedacht door schrijver Jerry Siegel en tekenaar Joe Shuster, en verscheen voor het eerst in Action Comics #1 (gedateerd juni 1938 en gepubliceerd op 18 april 1938).",Kryptonian,2022-04-27 10:00:00,2022-04-27 10:00:00
3,2,en,"Batman is a fictional superhero appearing in American comic books published by DC Comics. The character was created by artist Bob Kane and writer Bill Finger, and first appeared in Detective Comics #27 in 1939.",Human,2022-04-27 10:00:00,2022-04-27 10:00:00
4,2,nl,"Batman is een fictieve superheld die voorkomt in Amerikaanse stripboeken uitgegeven door DC Comics. Het personage werd bedacht door tekenaar Bob Kane en schrijver Bill Finger, en verscheen voor het eerst in Detective Comics #27 in 1939.",Human,2022-04-27 10:00:00,2022-04-27 10:00:00
5,3,en,"Wonder Woman is a fictional superhero appearing in American comic books published by DC Comics. The character is a founding member of the Justice League. The character first appeared in All Star Comics #8 in October 1941 with her first feature in Sensation Comics #1 in January 1942.",Amazonian,2022-04-27 10:00:00,2022-04-27 10:00:00
